Review_Date,Positive_Review,Negative_Review,Reviewer_Score,Tags,Total_Number_of_Reviews_Reviewer_Has_Given,days_since_review,month_idx,days_num,doc_id
2017-03-31,Leo the masseur was magic one of the best massages I have ever had Reception staff were helpful,The wait at the spa was excessively long there weren t enough seats for everyone waiting Having to sit in a short dressing gown in a crowded room with several men is not my idea of a relaxing way to wait for a spa treatment The wet area was also crowded and was much smaller than it looked in the photos Apart from the wonderful massage the whole spa experience was very disappointing Toiletries in room not replaced until I asked Not enough breakfast tea bags supplied Bed too hard No slippers provided in room,6.7,"[' Leisure trip ', ' Solo traveler ', ' Junior Double ', ' Stayed 3 nights ']",29,125 day,3,125,236
2016-04-05,Great Value for Money,No Negative,7.5,"[' Business trip ', ' Solo traveler ', ' Deluxe Room ', ' Stayed 5 nights ']",2,485 day,4,485,237
2016-04-05,Location spot on building and interiors were gorgeous a design lovers dream Food was fab and the Apple Macs in reception were very popular with daughter,The very loud music which started at 9 30 on Friday and sometimes staff a little too laid back,8.8,"[' Leisure trip ', ' Family with young children ', ' Deluxe King Room ', ' Stayed 2 nights ', ' Submitted from a mobile device ']",1,485 day,4,485,238
2016-04-26,Location,No security and as everybody knows a lot thieves in Barcelona I was stolen mobile inside the hotel and so that is not acceptable Also the fact that hotell staff didnt even make an effort to find solution Terrible,4.6,"[' Business trip ', ' Solo traveler ', ' Basic Double Room ', ' Stayed 1 night ']",7,464 day,4,464,239
2016-04-09,The staff at the front desk and front door were very helpful professional and also quite funny in a very cheerful way When we asked for more milk for the tea in our room I received a jug of cold milk from the kitchen which lasted us for several days in the room fridge EVening meal was excellent Although too cold to swim in March the roof top pool and surroundings will be great for relaxing in warmer months,No Negative,10,"[' Leisure trip ', ' Couple ', ' Premium Double Room ', ' Stayed 3 nights ']",10,481 day,4,481,240
2016-04-26,No Positive,Charging for wi fi Seriously In 2016,6.3,"[' Leisure trip ', ' Group ', ' Deluxe Room ', ' Stayed 2 nights ']",2,464 day,4,464,241
2017-04-05,Great staff very friendly always smiling and professional Hotel itself is well located near Tour Eiffel and Champs Elysees and is well maintained Room and bathroom were clean and bed very comfi,Nothing,9.6,"[' Leisure trip ', ' Couple ', ' Superior Double Room with Balcony ', ' Stayed 2 nights ']",3,120 day,4,120,242
2016-04-12,Staff polite good service in general around hotel Room s comfortable,Concierge service lights in room bright and unable to cover or turn off e g attached to alarms,7.5,"[' Leisure trip ', ' Family with older children ', ' Twin Hilton Guest Room ', ' Stayed 1 night ']",1,478 day,4,478,243
2016-04-01,View and facilities,N A,9.2,"[' Leisure trip ', ' Couple ', ' Junior Suite 2 Adults ', ' Stayed 2 nights ', ' Submitted from a mobile device ']",1,489 day,4,489,244
2017-04-19,Very comfortable,I paid parking charges 32 for two days they don t have a own parking space which is really bad,8.3,"[' Leisure trip ', ' Couple ', ' Double or Twin Room ', ' Stayed 2 nights ', ' Submitted from a mobile device ']",1,106 day,4,106,245
2016-04-05,The bedroom was modern It was well located near the university 5 mins from nearest underground station Lovely view of gothic church from our room Lots of caf s within couple of minutes walk and a Bar across the road Nice walk into centre in bout 15 mins or so,Bathroom was a little tired and could do with overhaul but it was cleaned to a good standard no lift available on ground floor had to take stairs up until you reached lift on 1st floor,7.5,"[' Leisure trip ', ' Couple ', ' Standard Double Room ', ' Stayed 3 nights ', ' Submitted from a mobile device ']",3,485 day,4,485,246
2017-04-10,Friendly staff room was spotless and comfy although a little airless The situation of the hotel proximity to tube station excellent Quiet Great breakfast Lovely lovely place,No shelf at the sink but I did my makeup at the desk instead no deal breaker,10,"[' Leisure trip ', ' Couple ', ' Deluxe Double Room ', ' Stayed 2 nights ', ' Submitted from a mobile device ']",2,115 day,4,115,247
2016-04-29,Great location and great breakfast buffet,Not practical for a business traveller no iron and Wifi was poor,8.3,"[' Business trip ', ' Solo traveler ', ' Single Room ', ' Stayed 1 night ', ' Submitted from a mobile device ']",4,461 day,4,461,248
2017-04-07,great value for money,No Negative,10,"[' Leisure trip ', ' Couple ', ' City King Room ', ' Stayed 1 night ']",5,118 day,4,118,249
2017-04-05,The quality and ambience of the hotel,No Negative,9.6,"[' Business trip ', ' Solo traveler ', ' Deluxe Junior Suite ', ' Stayed 3 nights ', ' Submitted from a mobile device ']",10,120 day,4,120,250
2016-04-29,The staff where friendly despite the language barrier and where very helpful The room was a good size and the bathroom facilities where good with a nice powerful shower,The WiFi was very unstable and the TV channels apart from a few news channels were in Spanish or other none English Languages I m not sure if its a British thing but Tea Coffee Facilities would have been appreciated,7.9,"[' Leisure trip ', ' Group ', ' Double or Twin Room ', ' Stayed 6 nights ']",3,461 day,4,461,251
2016-04-16,We were quite pleased with everything The Axel Hotel will always be our home in future visits to Barcelona,No dislikes,10,"[' Leisure trip ', ' Couple ', ' Double or Twin Room ', ' Stayed 4 nights ', ' Submitted from a mobile device ']",1,474 day,4,474,252
2016-04-26,Staff was so friendly and helpful Recieved cava on arrival Room was stunning got upgraded to a room with a balcony over looking the plaza Best hotel I ve stayed in,No Negative,10,"[' Leisure trip ', ' Couple ', ' Double Room ', ' Stayed 2 nights ']",1,464 day,4,464,253
2017-04-17,Fantastic view of Wembley Lovely room And the 9bar is definitely a must,If your driving the parking is a nightmare,9.6,"[' Leisure trip ', ' Couple ', ' Deluxe King Room with Stadium View ', ' Stayed 1 night ', ' Submitted from a mobile device ']",1,108 day,4,108,254
2016-04-07,Location is great 1 2 block from Plaza de Catalunia Staff very friendly,Inside room without any windows Small bed Very basic,8.3,"[' Leisure trip ', ' Couple ', ' Double or Twin Room ', ' Stayed 1 night ']",6,483 day,4,483,255
2017-04-27,Central location easily accessible,Poor breakfast little soundproofing in bedroom overpriced,6.3,"[' Business trip ', ' Solo traveler ', ' Club Double Room ', ' Stayed 2 nights ', ' Submitted from a mobile device ']",32,98 days,4,98,256
2017-04-21,Bed is very comfy staff are always helpful and the hotel is the perfect location for the O2,Nothing,10,"[' Leisure trip ', ' Couple ', ' Double or Twin Room ', ' Stayed 1 night ', ' Submitted from a mobile device ']",3,104 day,4,104,257
2016-04-03,I loved the food at the restaurant,No Negative,10,"[' Leisure trip ', ' Couple ', ' Standard Double Room without Window ', ' Stayed 3 nights ', ' Submitted from a mobile device ']",1,487 day,4,487,258
2016-04-26,The staff wereexcellent,The plug in the wash hand basin was broken,9.2,"[' Leisure trip ', ' Group ', ' 2 rooms ', ' Stayed 2 nights ', ' Submitted from a mobile device ']",12,464 day,4,464,259
2016-04-04,Lovely friendly staff right beside metro nice restaurants close by comfortable beds,Mini bar had been used before our arrival pointed this out to reception who sent someone to check was half replenished 3 days into our trip mini bar was emptied without comment or consultation with us again onus was on us to contact reception so as not to be charged,9.2,"[' Leisure trip ', ' Group ', ' Classic Double or Twin Room ', ' Stayed 5 nights ', ' Submitted from a mobile device ']",15,486 day,4,486,260
2017-04-30,Spacious rooms We got the executive rooms The staff were nice The location was accessible but a bit of a walk from the center of the city,No Negative,7.1,"[' Leisure trip ', ' Group ', ' Executive King Room ', ' Stayed 2 nights ', ' Submitted from a mobile device ']",25,95 days,4,95,261
2016-04-21,The room was clean and spacious The housekeeping team is great The tram was 3 minutes walk from the hotel It takes 15 min to get to West banhoef,During the luggage storing i would have liked if they could tag my suite case instead of just putting all luggage with no mark Its just feel safer And as a four star hotel that should be a basic service,8.3,"[' Leisure trip ', ' Solo traveler ', ' Superior Twin Room ', ' Stayed 3 nights ', ' Submitted from a mobile device ']",5,469 day,4,469,262
2016-04-14,Central location good breakfast friendly staff,Avoid rooms outside of main hotel as room was noisy and next to a hashish cafe and smoke drifted into the room,6.7,"[' Leisure trip ', ' Couple ', ' Apartment ', ' Stayed 5 nights ', ' Submitted from a mobile device ']",4,476 day,4,476,263
2016-04-28,It was simply the perfect hotel with amazing service,No Negative,10,"[' Leisure trip ', ' Couple ', ' Executive Double Room ', ' Stayed 4 nights ', ' Submitted from a mobile device ']",1,462 day,4,462,264
2016-04-24,Everything from the moment we stepped into the hotel to the time we left,Everything was excellent,10,"[' Leisure trip ', ' Family with young children ', ' Superior Twin Room ', ' Stayed 1 night ', ' Submitted from a mobile device ']",1,466 day,4,466,265
2016-04-10,excellent location nice staff great breakfast,Hotel is under construction,8.8,"[' Leisure trip ', ' Solo traveler ', ' Basic Single Room ', ' Stayed 1 night ']",7,480 day,4,480,266
2016-04-23,No Positive,The staff is not helpful They removed our extra bed without any notice And only about to give us one at midnight,2.5,"[' Leisure trip ', ' Family with young children ', ' Standard Double or Twin Room ', ' Stayed 3 nights ']",1,467 day,4,467,267
2017-04-13,Ottimo tutto,No Negative,10,"[' Business trip ', ' Group ', ' Superior Double Room ', ' Stayed 3 nights ']",11,112 day,4,112,268
2016-04-14,The room was wonderful the food was fantastic,No Negative,9.6,"[' Leisure trip ', ' Group ', ' Superior Twin Room ', ' Stayed 4 nights ', ' Submitted from a mobile device ']",1,476 day,4,476,269
2016-04-26,As an 1865 member as usual Could not fault anything Club Lounge as usual wonderful All staff especially Norbert looks after everyone,Nothing everything First Class,10,"[' Leisure trip ', ' Group ', ' Executive Room ', ' Stayed 1 night ', ' Submitted from a mobile device ']",1,464 day,4,464,270
2016-04-07,No Positive,the resturant at the reception their staff verry rude I waited for them as it s my turn the waiter lady was chating to their freinds and i waited almost 45 minutes till she come back to me I told the manger about it and he didn t care he was the one without hair note that always every year i come and I receive the same bade service and there is allot of bad things at the hotel which needs a 50 000 word atleast to talk about I never ever recomend this hotel to anyone if you need your vacation to be perfect choose another 5 star hotel near by thank you,2.5,"[' Leisure trip ', ' Group ', ' Classic Room ', ' Stayed 3 nights ', ' Submitted from a mobile device ']",1,483 day,4,483,271
2016-04-03,facility accessibility cleaness,price,5.4,"[' Leisure trip ', ' Group ', ' Special Offer Double Room ', ' Stayed 2 nights ']",1,487 day,4,487,272
2017-04-21,STAFFS ARE VERY FRIENDLY subway green line U4 is right at the site convenient,No Negative,10,"[' Leisure trip ', ' Family with young children ', ' Classic Double Room ', ' Stayed 2 nights ']",12,104 day,4,104,273
2016-04-11,I was fooled by the Location on the river and the Balcony So disappointed The hotel is only the 1st 2 floors of the building so you won t be getting any view of the river only noises screaming train sound and police siren from the street Rooms and bathroom were OK a bit small Breakfast is average breads eggs cheese and cereals,I didn t like the bed l 2 single beds stuck to each other and 2 separate single covers not queen or king but it was like this in the other 2 hotels in Austria as well So I guess this is their couple system,6.7,"[' Leisure trip ', ' Couple ', ' Double Room with Balcony ', ' Stayed 3 nights ']",56,479 day,4,479,274
2017-04-03,Breakfast was very pleasant and the variety of well cooked food was very good The atmosphere in the restaurant with good classical music being played just added up positively to the productive beginning of the working week,Unfortunately some of the personnel does not speak good English while my German skills also desire improvement But we still managed,9.2,"[' Business trip ', ' Solo traveler ', ' Classic Single Room ', ' Stayed 1 night ']",5,122 day,4,122,275
2016-04-08,Everything always a pleasure to stay there,Not found anything,10,"[' Business trip ', ' Solo traveler ', ' Deluxe Double Room ', ' Stayed 1 night ', ' Submitted from a mobile device ']",5,482 day,4,482,276
2017-04-25,Perfect location and the staff was very friendly The hotel is only few minutes walk from the tube station You don t even have to leave the area tho you ll find museums restaurants pubs cafes and loads to do right there,No Negative,9.6,"[' Leisure trip ', ' Group ', ' Double Room ', ' Stayed 2 nights ', ' Submitted from a mobile device ']",7,100 day,4,100,277
2017-04-09,Near to places we wanted to visit,They put us in basement room next to kitchen and dining room Very noisy Also started decorating whilst we were there didn t tell us got paint on my jacket I complained 3 times and the manager was never available always in a meeting,4.2,"[' Leisure trip ', ' Couple ', ' Double Room ', ' Stayed 2 nights ', ' Submitted from a mobile device ']",1,116 day,4,116,278
2017-04-29,Beautiful unique hotel especially at night Staff were very friendly and helpful Breakfast was great,Very remote from center of Amsterdam but that made for more of an adventure,9.6,"[' Leisure trip ', ' Solo traveler ', ' Deluxe Double Room ', ' Stayed 2 nights ', ' Submitted from a mobile device ']",2,96 days,4,96,279
2016-04-04,Excellent housekeeping,Bed were rather small,7.1,"[' Leisure trip ', ' Couple ', ' Standard Double ', ' Stayed 4 nights ']",2,486 day,4,486,280
2016-04-30,Was always good now it s excellent,No Negative,10,"[' Business trip ', ' Solo traveler ', ' Classic Double Room ', ' Stayed 1 night ', ' Submitted from a mobile device ']",5,460 day,4,460,281
2017-04-05,No Positive,The room was dirty and cold,4.2,"[' Leisure trip ', ' Family with young children ', ' Double or Twin Room ', ' Stayed 1 night ', ' Submitted from a mobile device ']",3,120 day,4,120,282
2017-04-25,Excellent location for someone going to an event at the London Palladium Excellent bed and top notch bathroom,The chaos at breakfast with too many having breakfast at the same time,8.3,"[' Leisure trip ', ' Couple ', ' Standard Double Twin Room ', ' Stayed 2 nights ']",5,100 day,4,100,283
2016-04-25,Lovely room comfortable bed gorgeous breakfast with amazing choice Great location with wonderful views of the river skyline from the hotel bar Would probably ask for a room with a view next time,The complimentary ferry there was a massive queue of people queuing up to catch the ferry after the gig we were attending at the 02 and we could see the boat was just sitting there the other side of the water unmanned it should have been there waiting when the gig finished Lots of people stay at this hotel because they re attending a gig at the 02 so the hotel really needs to get this weighed up,9.2,"[' Leisure trip ', ' Couple ', ' Queen Guest Room ', ' Stayed 1 night ']",3,465 day,4,465,284
2017-04-09,No Positive,Room in terrible condition,2.5,"[' Leisure trip ', ' Group ', ' Standard Twin Room ', ' Stayed 1 night ', ' Submitted from a mobile device ']",6,116 day,4,116,285
2016-04-14,Staff very friendly very clean and good quality breakfast,pool warmer,9.4,"[' Leisure trip ', ' Family with young children ', ' Double or Twin Room 2 Adult 1 Children ', ' Stayed 1 night ']",2,476 day,4,476,286
2017-04-26,All good Nice location and good value for money PS I have made my reservation last minute so I can t be really unbiased Great breakfast not wonderful I will come back,nothing,10,"[' Business trip ', ' Solo traveler ', ' Double or Twin Room ', ' Stayed 1 night ']",22,99 days,4,99,287
2017-04-06,The warm cookies when you arrive,No place for bike lock,8.3,"[' Business trip ', ' Solo traveler ', ' Queen Guest Room ', ' Stayed 1 night ']",19,119 day,4,119,288
2017-04-01,The bar and staff,I booked 2 twin beds and they were right up against each other Mattresses soft,7.9,"[' Leisure trip ', ' Family with young children ', ' Standard Double or Twin Room ', ' Stayed 2 nights ', ' Submitted from a mobile device ']",1,124 day,4,124,289
2017-04-10,The Rooms and Bathrooms were nicely decorated High Definition TV Free wi fi worked really well The staff were very friendly and accommodating The location of the Hotel was perfect for shopping and site seeing Security Room for luggage as our flight left later in the day I chose it because of its high rating and I have to say it lives up to its reputation Book with confidence,Only 5 day stay,10,"[' Leisure trip ', ' Family with young children ', ' Quadruple Room ', ' Stayed 5 nights ']",3,115 day,4,115,290
2016-04-12,Great location,The room was tiny,6.3,"[' Solo traveler ', ' Double Room ', ' Stayed 2 nights ', ' Submitted from a mobile device ']",4,478 day,4,478,291
2017-04-20,Nice location close to the Eiffel Tower and supermarket nice and clean rooms and nice staffs,Nothing,8.8,"[' Leisure trip ', ' Family with older children ', ' Deluxe Triple Room ', ' Stayed 3 nights ', ' Submitted from a mobile device ']",31,105 day,4,105,292
2017-04-24,Location was great next to Milan Central station staff very helpful friendly the room was great with a nice view,There are no Power outlets on the sides of the bed You cannot charge your cellphone,9.2,"[' Leisure trip ', ' Couple ', ' Superior Double Room ', ' Stayed 5 nights ', ' Submitted from a mobile device ']",5,101 day,4,101,293
2016-04-17,The Sofitel is both luxurious and conveniently located in the Old Town area The breakfast staff Dorothy Simone Nanette Brianca and the rest of the staff were exceptional especially with our two kids Superb staff always smiling and helpful Even they got gifts to our little kids Breakfast is great and has a lot to choose from The butler service is amazing especially Mauricio and Domingo They arranged for our personalized tours and they are very helpful whenever we need them The hotel staff is wonderful especially Michel the evening Manager The housekeeping did a great job without noticing them,The Seafood restaurant Bridges for dinner is Okay but very pricey,9.2,"[' Leisure trip ', ' Family with young children ', ' Luxury Room 3 Adults with canal view ', ' Stayed 6 nights ']",1,473 day,4,473,294
2017-04-06,The one who served us his name is Mohammed was very helpful to us We thank him so much,No Negative,7.1,"[' Leisure trip ', ' Family with young children ', ' Standard Twin Room ', ' Stayed 4 nights ', ' Submitted from a mobile device ']",11,119 day,4,119,295
2016-04-08,The staff were extremely helpful and friendly They answered any queries I had with the utmost efficiency The room was very nice and the bed was very comfortable,No Negative,10,"[' Leisure trip ', ' Solo traveler ', ' Standard Queen Room ', ' Stayed 1 night ']",12,482 day,4,482,296
2016-04-19,Location room size staff,No Negative,9.6,"[' Leisure trip ', ' Couple ', ' Studio Suite ', ' Stayed 2 nights ', ' Submitted from a mobile device ']",12,471 day,4,471,297
2016-04-30,Location,Breakfast selection poor even when we went 45 minutes before end of service time Couldn t believe difference on day we were leaving when choice was excellent Not listed anywhere bar opening times and advised to use room mini bar No prices in room for cost of items Shower leaked and not repaired despite reporting it,5.8,"[' Leisure trip ', ' Family with older children ', ' Twin Room ', ' Stayed 5 nights ', ' Submitted from a mobile device ']",1,460 day,4,460,298
2017-04-18,Very friendly staff great property,No Negative,10,"[' Leisure trip ', ' Family with young children ', ' Superior Double or Twin Room ', ' Stayed 4 nights ', ' Submitted from a mobile device ']",1,107 day,4,107,299
2016-04-03,Room was lovely great location friendly staff,Room looked out to square with irish bar which was loud late into the night,8.8,"[' Leisure trip ', ' Family with older children ', ' Double or Twin Room ', ' Stayed 3 nights ', ' Submitted from a mobile device ']",7,487 day,4,487,300
2017-04-19,Staff is definitely the gold of this wonderfully and beautifully decorated hotel Everyone we encountered was super nice helpful and knowledgeable and could put a smile on your face Also the location is very convenient close to several metro stations and excellent boulangeries and eateries And we were happy to notice the windows of our street facing room provide good soundproofing from the lively french nightlife so you can have a good night s sleep,The minibar in our room was a tad noisy But after a full day in Paris even the lightest sleepers will drift off into the dreamland and not notice the minibar noise,8.8,"[' Leisure trip ', ' Couple ', ' Classic Double Room ', ' Stayed 3 nights ']",1,106 day,4,106,301
2017-04-05,Great Location Clean,Bed uncomfortable too hard Breakfast buffet area far too small for size of hotel Ran out of bowls first morning 25 00 For a burger and extra portion of chips,6.7,"[' Leisure trip ', ' Family with young children ', ' Superior Room with Queen size bed and Sofa Bed ', ' Stayed 2 nights ']",1,120 day,4,120,302
2017-04-24,Very contemporary,Ridiculously tiny rooms they didn t even have a closet Badly advertised by Booking com If I knew all rooms were size of a shoe box I would have never gone to that property Only found out after checking in and had no choice was profoundly claustrophobic in there Terrible experience,5.8,"[' Business trip ', ' Solo traveler ', ' Single Room ', ' Stayed 4 nights ', ' Submitted from a mobile device ']",1,101 day,4,101,303
2017-04-10,Good breakfast,The rooms,7.1,"[' Leisure trip ', ' Family with young children ', ' Standard Double Room ', ' Stayed 6 nights ', ' Submitted from a mobile device ']",1,115 day,4,115,304
2017-04-28,Hotel was fine and conveniently located to Hackney Wick where our son lives Didn t eat in the hotel as expensive,Breakfast wa expensive and we had a much better one in Hackney Wick,8.3,"[' Leisure trip ', ' Couple ', ' Twin Room Non Smoking ', ' Stayed 3 nights ', ' Submitted from a mobile device ']",1,97 days,4,97,305
2016-04-07,Location friendly helpful staff spotlessly clean good breakfast this was our third visit and will be returning next year,Low water pressure on the shower,9.6,"[' Leisure trip ', ' Couple ', ' Deluxe Double Room ', ' Stayed 3 nights ', ' Submitted from a mobile device ']",21,483 day,4,483,306
2017-04-10,executive lounge location spacious room,the shower shield in the bathroom is very small and thus almost impossible not to spill out water while showering room 302,8.8,"[' Business trip ', ' Family with young children ', ' Executive King Room ', ' Stayed 3 nights ']",22,115 day,4,115,307
2016-04-06,Excellent breakfast selection great location very helpful staff Very good wifi connection,Nothing,10,"[' Leisure trip ', ' Family with older children ', ' Double Room ', ' Stayed 2 nights ', ' Submitted from a mobile device ']",46,484 day,4,484,308
2017-04-15,The staff and specially Aleesia she was working in the executive lounge,I have to pay money to keep my laggage for two days,10,"[' Leisure trip ', ' Group ', ' Executive Twin Room ', ' Stayed 8 nights ', ' Submitted from a mobile device ']",1,110 day,4,110,309
2016-04-05,The staff were nice,The room was a bit dated,6.3,"[' Leisure trip ', ' Couple ', ' Superior Plus Double Room ', ' Stayed 1 night ', ' Submitted from a mobile device ']",1,485 day,4,485,310
2017-04-26,cleaness,No hand shower in bathroom,6.7,"[' Leisure trip ', ' Family with young children ', ' Double or Twin Room ', ' Stayed 2 nights ']",20,99 days,4,99,311
2016-04-09,Reasonable breakfast quite location,The service could be better when we called to ask for an extra pillow at 11 30PM the receptionist told us to come down to the reception to get one We ask several times to fix one of the lights in our room it was still not working when we left after 3 days,6.7,"[' Business trip ', ' Couple ', ' Double Room ', ' Stayed 3 nights ']",4,481 day,4,481,312
2017-04-11,A super hotel with excellent facilities Rooms very modern and clean Security is excellent staff very good and a really nice buzz to the hotel,Did not find the food very good in the restaurant for the price and breakfast was only ok,8.8,"[' Leisure trip ', ' Family with young children ', ' Studio King Family ', ' Stayed 3 nights ']",32,114 day,4,114,313
2016-04-12,Fair enough and it s ok,Location,6.7,"[' Leisure trip ', ' Couple ', ' One Bedroom Suite ', ' Stayed 2 nights ', ' Submitted from a mobile device ']",6,478 day,4,478,314
2016-04-30,Location Style of the hotel Rooms are beautiful,The common areas were cold Need to have fire working in the library,9,"[' Business trip ', ' Solo traveler ', ' Luxury Double Room ', ' Stayed 2 nights ', ' Submitted from a mobile device ']",4,460 day,4,460,315
