Review_Date,Positive_Review,Negative_Review,Reviewer_Score,Tags,Total_Number_of_Reviews_Reviewer_Has_Given,days_since_review,month_idx,days_num,doc_id
2016-08-09,Staff excellent,Tiny pool and closed gym,8.8,"[' Leisure trip ', ' Family with older children ', ' Standard Double or Twin Room ', ' Stayed 3 nights ', ' Submitted from a mobile device ']",1,359 day,8,359,685
2016-08-28,We were upgraded to a premium room for free Excellent location Excellent wifi connection Breakfast was great with many varieties and fresh juices Super clean room,No Negative,9.6,"[' Leisure trip ', ' Family with older children ', ' Superior King or Twin Room ', ' Stayed 1 night ', ' Submitted from a mobile device ']",42,340 day,8,340,686
2015-09-28,We had a good time at the hotel for the world cup rugby the staff so helpful and would stay with you again,No Negative,10,"[' Leisure trip ', ' Family with young children ', ' Executive King Room with Sofa Bed Non Smoking ', ' Stayed 1 night ', ' Submitted from a mobile device ']",1,675 day,9,675,687
2016-09-22,Rooms were small but immaculately clean and well outfitted and the breakfast was simple but good quality Staff were very helpful and friendly,No Negative,7.1,"[' Business trip ', ' Solo traveler ', ' Comfort Single Room ', ' Stayed 3 nights ']",11,315 day,9,315,688
2015-09-10,Nice hotel with good location and very clean we had a good time staying there,No Negative,8.8,"[' Leisure trip ', ' Family with older children ', ' Triple Room ', ' Stayed 3 nights ', ' Submitted from a mobile device ']",31,693 day,9,693,689
2016-09-01,Everything else seems fine,Could have provided a cordless kettle for our own purpose to boil water It s difficult to every now then to go to the bar level 13 request for boiling hot water,7.5,"[' Business trip ', ' Group ', ' Double or Twin Room ', ' Stayed 5 nights ', ' Submitted from a mobile device ']",1,336 day,9,336,690
2016-09-06,I only needed a nights accommodation near Gare du Nord Perfect location The reception I received was great The staff were really friendly and helpful as my French is pretty basic Loved that they encouraged me with my French too I liked the external view out the windows The doors opened and it was nice with the breeze in the sheer curtains The bed was vey comfortable I thought the value for money was also excellent,No Negative,10,"[' Leisure trip ', ' Solo traveler ', ' Standard Room with 1 Double Bed ', ' Stayed 1 night ']",1,331 day,9,331,691
2016-09-20,Excellent air conditioning,Room very small,6.3,"[' Business trip ', ' Couple ', ' Standard Double Room ', ' Stayed 3 nights ', ' Submitted from a mobile device ']",1,317 day,9,317,692
2015-09-12,The Staff Jessica was cute and the others at the reception were bravo class Room and Toilet 100 if you are doing the 11pm night show at Moulin Rougue perfect pit stop Restaurants galore,Nothing,10,"[' Leisure trip ', ' Couple ', ' Double or Twin Room ', ' Stayed 1 night ', ' Submitted from a mobile device ']",1,691 day,9,691,693
2015-09-21,The interior is very refreshing,The elevators are extremely slow,8.8,"[' Leisure trip ', ' Couple ', ' Deluxe Double Room with Balcony Non Smoking ', ' Stayed 1 night ', ' Submitted from a mobile device ']",18,682 day,9,682,694
2016-09-26,Very clean and conviently located to kings cross and several universities,It was a very warm week and there was no way to move air within the room It did however cool down nicely at night,10,"[' Leisure trip ', ' Couple ', ' Superior Double Room ', ' Stayed 6 nights ', ' Submitted from a mobile device ']",2,311 day,9,311,695
2015-09-27,Great location good facilities,Cleanliness Lots of room service dishes left in the corridor for the entire length of our stay nearly all tables at breakfast had dirty plates etc which were not cleared away,7.9,"[' Leisure trip ', ' Couple ', ' Deluxe King Room with Stadium View ', ' Stayed 1 night ', ' Submitted from a mobile device ']",2,676 day,9,676,696
2015-09-10,Staff were very helpful and friendly,The first room I was given had not been cleaned so I had to go back to reception to change rooms When ordering room service due to being ill I was told that I was unable to put the cost of the meal on the bill and that I needed to pay by cash as I didn t have enough cash on me I had to leave my room and get cash from an ATM Normally this would not be a problem but as I was feeling unwell it was a total inconvienience Breakfast was poor in standard over cooked dry and very un appealing,6.3,"[' Business trip ', ' Solo traveler ', ' King Room ', ' Stayed 1 night ']",1,693 day,9,693,697
2016-09-16,Location was next to the train station That s the only plus side,Beds decore internet keeps switching off,5.4,"[' Leisure trip ', ' Group ', ' 2 rooms ', ' Stayed 1 night ', ' Submitted from a mobile device ']",1,321 day,9,321,698
2016-09-30,Help staff and excellent location,Blanket is too thin and the poor quality slipper,9.2,"[' Leisure trip ', ' Couple ', ' Double or Twin Room 2 Adults ', ' Stayed 3 nights ', ' Submitted from a mobile device ']",2,307 day,9,307,699
2015-09-17,Every thing,No microwave toaster swimming pool,9.6,"[' Family with young children ', ' Superior Queen Suite with Sofa ', ' Stayed 14 nights ', ' Submitted from a mobile device ']",2,686 day,9,686,700
2016-09-21,room space near to Soho near to underground close to theatres,No Negative,9.6,"[' Leisure trip ', ' Couple ', ' Premier Double Room ', ' Stayed 1 night ']",12,316 day,9,316,701
2015-09-15,Pleasant location friendly staff,Armchair in the room was wet recently cleaned so couldn t use it no room numbers which caused confusion heated towel rail didn t work yapping dogs in the room next door,8.8,"[' Leisure trip ', ' Couple ', ' Standard Double Room with Park View ', ' Stayed 1 night ', ' Submitted from a mobile device ']",3,688 day,9,688,702
2015-09-20,cosy facilities near metro quiet,No Negative,7.9,"[' Leisure trip ', ' Family with older children ', ' Suite 5 Adults ', ' Stayed 3 nights ']",9,683 day,9,683,703
2016-09-20,Location And confy bed,Bery noisy U could do double glaze AC was not worong properly,6.3,"[' Leisure trip ', ' Family with young children ', ' Deluxe King Room ', ' Stayed 3 nights ', ' Submitted from a mobile device ']",1,317 day,9,317,704
2016-09-18,All very good will come again,No Negative,10,"[' Leisure trip ', ' Couple ', ' Twin Room Non Smoking ', ' Stayed 2 nights ']",1,319 day,9,319,705
2016-09-23,Location Nice design of the hotel Friendly staff Comfortable bed,Size of the budget room is very small and without any useful window After a shower the whole floor of the room is wet,8.3,"[' Leisure trip ', ' Couple ', ' Basic Double Room ', ' Stayed 3 nights ', ' Submitted from a mobile device ']",8,314 day,9,314,706
2015-09-13,The staff were very friendly helpful and welcoming,The room is too small and compact,7.5,"[' Leisure trip ', ' Group ', ' Superior Double Room ', ' Stayed 1 night ', ' Submitted from a mobile device ']",1,690 day,9,690,707
2016-09-28,Everything,No Negative,10,"[' Leisure trip ', ' Couple ', ' Superior Twin Room ', ' Stayed 1 night ', ' Submitted from a mobile device ']",2,309 day,9,309,708
2016-09-05,The location is second to none Staff are fantastic and the hotel itself is sheer magic,Not much not to like,9.2,"[' Leisure trip ', ' Couple ', ' Superior Double or Twin Room with Spa Access ', ' Stayed 2 nights ']",1,332 day,9,332,709
2015-09-06,Very clean Great location,Very small rooms No sound isolation,8.8,"[' Leisure trip ', ' Family with young children ', ' Club Twin Room ', ' Stayed 9 nights ', ' Submitted from a mobile device ']",4,697 day,9,697,710
2016-09-07,Perfect location Excellent d cor,No Negative,9.6,"[' Leisure trip ', ' Couple ', ' Small Queen Room ', ' Stayed 2 nights ']",51,330 day,9,330,711
2016-09-27,My room was next to the terrace with swimming pool The room standard was very good bathroom was excellent with a large jacuzi The view from the terrace was amazing facing Plaza Espana Beautiful,I had to pay slightly more than the price I booked for It might be the exchange rate The tv in the room wasn t working properly,7.9,"[' Leisure trip ', ' Solo traveler ', ' Double or Twin Room ', ' Stayed 2 nights ']",3,310 day,9,310,712
2015-09-09,No Positive,Too far from the city center,5.8,"[' Business trip ', ' Solo traveler ', ' Superior Twin Room ', ' Stayed 4 nights ', ' Submitted from a mobile device ']",8,694 day,9,694,713
2016-09-20,Staff were brilliant very helpful and so friendly The hotel location is fantastic for wandering Shoreditch The hotel is bright clean fresh and funky I loved everything about it We stay in Shoreditch a lot and have tried numerous places but this will be my only stop in the future,Nothing at all it was faultless,10,"[' Leisure trip ', ' Couple ', ' Double Room ', ' Stayed 1 night ']",6,317 day,9,317,714
2015-09-13,Near to station and good breakfast,Nil,10,"[' Business trip ', ' Solo traveler ', ' Double Room ', ' Stayed 1 night ', ' Submitted from a mobile device ']",4,690 day,9,690,715
2016-09-19,We had 2 triple rooms Amazing decor great sized rooms very modern and clean Friendly staff and huge breakfast dining area Huge parking space at the back of the hotel Nice Bar and lots of lifts Good choice at breakfast and plenty to go around with so many people,Location seems a bit out of the way and is located in the middle of what seemed like a residential area lots of flats,8.8,"[' Leisure trip ', ' Family with young children ', ' Triple Room ', ' Stayed 1 night ']",4,318 day,9,318,716
2015-09-15,Overall good facility great central location for shopping sightseeing dining Quiet,Marginal wifi only real irritant,9.2,"[' Leisure trip ', ' Couple ', ' Deluxe Double with Winter Garden View ', ' Stayed 2 nights ', ' Submitted from a mobile device ']",1,688 day,9,688,717
2016-09-30,Close to train station,dirty room balcony door broken bathroom door broken very dated unfriendly staff awful bed Would not recommend,4.2,"[' Leisure trip ', ' Couple ', ' Standard Double or Twin Room with Balcony ', ' Stayed 1 night ']",3,307 day,9,307,718
2016-09-15,I loved everything about this hotel The location was great the staff were all friendly and helpful and the room was huge and comfortable air conditioning mini bar etc Because we stayed one week we were upgraded to a bigger suite and it made our stay that much more special Vienna is a fabulous city and this hotel was a wonderful place to stay,Can t think of anything All good,10,"[' Leisure trip ', ' Family with young children ', ' Standard Studio ', ' Stayed 6 nights ', ' Submitted from a mobile device ']",8,322 day,9,322,719
2016-09-18,Nothing i liked,Did not feel welcomed at all It takes ages to check in and you need to ask for everything Very basic hotel 3 star hotels are even better in Barcelona,3.8,"[' Leisure trip ', ' Group ', ' Double or Twin Room ', ' Stayed 2 nights ', ' Submitted from a mobile device ']",1,319 day,9,319,720
2015-09-01,It was in good area everything was great,No Negative,10,"[' Leisure trip ', ' Family with young children ', ' Superior Room with Queensize Bed and double couch 2 adults 2 children ', ' Stayed 2 nights ', ' Submitted from a mobile device ']",1,702 day,9,702,721
2016-09-06,nothing at all,the place was filthy despite me paying an extra 20 to upgrade to an executive suite only 2 teabags no coffee and 2 milk bathroom floor filthy bed was falling apart whole room dated and stank of smoke,2.9,"[' Leisure trip ', ' Solo traveler ', ' Standard Double Room without Window ', ' Stayed 1 night ']",1,331 day,9,331,722
2016-09-24,Everything except dust in bedroom,Lots of dust in bedroom,8,"[' Leisure trip ', ' Family with older children ', ' Small Double Room ', ' Stayed 2 nights ', ' Submitted from a mobile device ']",12,313 day,9,313,723
2015-09-10,Lovely hotel in a perfect location,WiFi did not work in my room I chose an expensive hotel to make sure they had a proper internet but it did not work in my room I really needed it and had to sit downstairs at the reception to be able to work,6.7,"[' Business trip ', ' Solo traveler ', ' Standard Double Room ', ' Stayed 2 nights ', ' Submitted from a mobile device ']",13,693 day,9,693,724
2016-09-29,A good and central location near underground and tram nice staff good breakfast buffet comfortable suite,One small problem after staying almost a week in the suite and second time at this hotel we were not able to stay 4 more hours as a late check out Not in the suite and not in any other room which is very uncomfortable before flight We did ask that upon reservation,9.2,"[' Leisure trip ', ' Couple ', ' Suite ', ' Stayed 5 nights ']",13,308 day,9,308,725
2016-09-01,It is almost impossible to fault this hotel location staff cool factor rooms,No Negative,10,"[' Leisure trip ', ' Couple ', ' Classic Double Room ', ' Stayed 3 nights ', ' Submitted from a mobile device ']",4,336 day,9,336,726
2016-09-19,Bed was extremely comfortable and lovely staff,The sink in the bathroom water not going down well,10,"[' Leisure trip ', ' Couple ', ' Twin Guest Room ', ' Stayed 1 night ', ' Submitted from a mobile device ']",3,318 day,9,318,727
2016-09-05,Location is excellent and you pay for it I wish we would have asked the staff for guidance a day earlier re transportation Once we did they were amazing the staff made the stay worth every penny,Room was a bit tight for two with large suitcases The kettle in our room wasn t working that was really the only issue so clearly a non issue,7.9,"[' Leisure trip ', ' Family with young children ', ' Superior Double Room ', ' Stayed 1 night ', ' Submitted from a mobile device ']",1,332 day,9,332,728
2016-09-29,Staff where amazing We had great food and service in the bar Loved the Location lots of bars and restaurants,No Negative,10,"[' Business trip ', ' Couple ', ' Deluxe Double Room with Private Access to Pool and Spa ', ' Stayed 5 nights ', ' Submitted from a mobile device ']",2,308 day,9,308,729
2015-09-01,girls at breakfast Time were very helpful,Lady on reception was a little rude Bedroom needed some improvement a little over priced for what it was Toilet in reception didn t have a light working,5.4,"[' Leisure trip ', ' Couple ', ' Double Room ', ' Stayed 2 nights ', ' Submitted from a mobile device ']",7,702 day,9,702,730
2016-09-18,Great Location and firendly staff the hotel overall is good,It is very noisy but is logical because you are in the middle of a party square,8.3,"[' Business trip ', ' Solo traveler ', ' Standard Single Room ', ' Stayed 5 nights ']",23,319 day,9,319,731
2016-09-09,Very nice atmosphere room details and finishes are of a very high standard,Well It s not really a hotel so don t expect those types of amenities There is really no reception when you walk through the front door you literally walk into their bar which is super nice by the way There are very limited food options snacks basically and no dining options Although within a few metres from the front door there are several great dining options Because I was there on business it should be noted that the bedroom was not so great for doing work the desk is an antique and so was the chair meaning pretty uncomfortable So not great for the business traveler but awesome for a weekend getaway,7.9,"[' Business trip ', ' Solo traveler ', ' Deluxe King Room ', ' Stayed 2 nights ']",15,328 day,9,328,732
2015-09-01,Perfect location and helpful staff,No Negative,9.2,"[' Leisure trip ', ' Couple ', ' Standard Double Room ', ' Stayed 1 night ', ' Submitted from a mobile device ']",3,702 day,9,702,733
2016-09-15,Great location close to centrale station Nice and helpful staff Very good breakfast selection,No Negative,9.2,"[' Leisure trip ', ' Family with young children ', ' Quality Double or Twin Room ', ' Stayed 1 night ']",21,322 day,9,322,734
2015-09-06,Staff extra helpful,Standard rooms very cramped and walls thin,10,"[' Business trip ', ' Solo traveler ', ' Classic Twin Room ', ' Stayed 1 night ']",10,697 day,9,697,735
2015-09-03,The Location,1 The Roomservice has additional 7 00 charge and they only bring it on a try if they charge fine but than with a proper setting or at least asking if i prefer tray or table 2 The people on check in counter only welcomed me and not the person I was very obvious with not good attitude,9.6,"[' Couple ', ' Deluxe Double or Twin Room ', ' Stayed 2 nights ']",55,700 day,9,700,736
2016-09-03,The breakfast had a good variety the room was very clean and had air con staff were friendly and helpful delighted with the stay,The shower wasn t great the power was quite poor as some parts weren t working,9.6,"[' Leisure trip ', ' Group ', ' Superior Double or Twin Room ', ' Stayed 2 nights ', ' Submitted from a mobile device ']",1,334 day,9,334,737
2015-09-15,Location was excellent,No window view just air vent that kept closing,8.3,"[' Leisure trip ', ' Couple ', ' Standard Double Room ', ' Stayed 1 night ', ' Submitted from a mobile device ']",6,688 day,9,688,738
2015-09-22,excellent location and service,No Negative,9.6,"[' Leisure trip ', ' Couple ', ' Classic Double Room ', ' Stayed 1 night ']",1,681 day,9,681,739
2016-09-24,No Positive,The fact that they took an extra charge of one night after paying for two nights,6.7,"[' Leisure trip ', ' Solo traveler ', ' Double or Twin Room ', ' Stayed 2 nights ', ' Submitted from a mobile device ']",1,313 day,9,313,740
2015-09-08,Excellent location,I seem to have been charged twice for my stay on my Visa card which will need to be addressed urgently,8.3,"[' Business trip ', ' Family with young children ', ' Superior Room ', ' Stayed 3 nights ', ' Submitted from a mobile device ']",3,695 day,9,695,741
2016-09-03,Lovely friendly staff,Could not fault anything,10,"[' Leisure trip ', ' Solo traveler ', ' Superior Queen Room ', ' Stayed 3 nights ', ' Submitted from a mobile device ']",2,334 day,9,334,742
2016-09-15,Reception staff were helpful free wifi location next to mall which is a bonus to me since i have a child with me,I toke my luggage myself since the concerned staff was not there while checked in and out the cleanliness was good but not perfect they did not take the dirty glasses one day they didnt put new towels,7.9,"[' Leisure trip ', ' Family with young children ', ' Double or Twin Room with Extra Bed ', ' Stayed 5 nights ', ' Submitted from a mobile device ']",1,322 day,9,322,743
2016-09-20,Location friendly staff comfortable rooms,No Negative,10,"[' Leisure trip ', ' Travelers with friends ', ' 2 rooms ', ' Stayed 2 nights ', ' Submitted from a mobile device ']",4,317 day,9,317,744
2015-09-06,Lovely clean room within close proximity of the tourist attractions and theatres,Very noisy traffic outside including lots of shouting from the street on an evening Bed could have been more comfortable,8.3,"[' Leisure trip ', ' Couple ', ' Compact Double Room ', ' Stayed 3 nights ', ' Submitted from a mobile device ']",1,697 day,9,697,745
2015-09-17,The rooms and comfort,Food was poor and service very slow,6.7,"[' Business trip ', ' Solo traveler ', ' Standard Double or Twin Room ', ' Stayed 2 nights ', ' Submitted from a mobile device ']",5,686 day,9,686,746
2015-09-11,We were both pretty wrecked after an all night flight and found the staff to be extremely friendly and helpful it really meant a lot,No Negative,10,"[' Leisure trip ', ' Couple ', ' Double or Twin Room ', ' Stayed 2 nights ']",1,692 day,9,692,747
2015-09-22,The staff were so welcoming from the minute we walked into the hotel They were extremely professional helpful polite well mannered you could see their interaction and engagement with you was genuine and that they cared about your stay They could not be more helpful The hotel was gorgeous in terms of presentation and the services on offer The bar was impressive and the food was excellent Our suite was divine and they made a very special weekend even more special with complimentary wine strawberries with chocolate balloons and gifts Just so perfect,N A,9.6,"[' Leisure trip ', ' Group ', ' Superior Double Room ', ' Stayed 1 night ']",3,681 day,9,681,748
2015-09-01,rooftop pool spectacular staff super friendly clean fabulous location,nothing,10,"[' Leisure trip ', ' Solo traveler ', ' Double or Twin Room 1 2 Adults ', ' Stayed 1 night ']",32,702 day,9,702,749
2015-09-08,Breakfast is nice,Some fundamental design flaw about the toilet the door cannot be closed properly The whole room stinks all the time The hotel floors have some kind of weird sourish smell,6.3,"[' Leisure trip ', ' Family with older children ', ' Superior Premium Room with Queen Bed Sofa ', ' Stayed 4 nights ', ' Submitted from a mobile device ']",4,695 day,9,695,750
2015-09-18,Good bed breakfast was varied good service Next to metro stop,Unfriendly reception spotty wifi,7.1,"[' Leisure trip ', ' Couple ', ' Double Room ', ' Stayed 2 nights ', ' Submitted from a mobile device ']",23,685 day,9,685,751
2016-09-18,The excellent breakfast choice,The roof top Terrace bar was not as good as last year the worst Mojito ever no RUM and service was so slow Last year we used the terrace very day this time only twice Room was not serviced until 6 00pm on one day and not service properly There had been a leak from the shower at some point and the vinyl was damaged would have expected this to have been replaced in a 4 star plus property,8.3,"[' Leisure trip ', ' Couple ', ' Double Room with View ', ' Stayed 7 nights ']",3,319 day,9,319,752
2016-09-12,Location,High price and small room,7.5,"[' Leisure trip ', ' Couple ', ' Art King Room ', ' Stayed 3 nights ', ' Submitted from a mobile device ']",5,325 day,9,325,753
2016-09-01,Great location very helpful staff clean comfortable,No Negative,10,"[' Leisure trip ', ' Family with young children ', ' Superior Double Room with View Non Smoking ', ' Stayed 2 nights ', ' Submitted from a mobile device ']",12,336 day,9,336,754
2016-09-12,Doesn t a 4 star hotel have to have gym right Because here u had to walk 1km and pay even extra like 15euro feeling guilty if u ever forget the voucher What I loved the attitude of the manager that really knows how to treat the customers that stayed like 2 months in the hotel and telling them that booking com its the most important for them not the customer curious what kind of school she made U should give her a bonus and hire her at booking she is very loyal at everything means money,What I didn t like people forgething that u treat them nice like no other tourist trying to give them presents and treat them friendlly but when they received orders not to smile anymore they changed their attitude in front of you,6.7,"[' Leisure trip ', ' Solo traveler ', ' Double or Twin Room ', ' Stayed 1 night ', ' Submitted from a mobile device ']",4,325 day,9,325,755
2016-09-25,We travelled to Amsterdam to stay in the Ramada Apollo for my mams 50th birthday There was a group of 20 of us It wasn t only a celebration for my mam as my boyfriend decided to suprise me with asking me to marry him The hotel staff went above and beyound to help him and were so lovely to us after I can t thank them enough and couldn t recommend the hotel enough It was actually our second time to stay in the hotel which says it all really we recommended it to our family as we had such a lovely time on our first trip It s a weekend I will never forget and can t praise the staff enough,No Negative,10,"[' Leisure trip ', ' Couple ', ' Deluxe Double Room ', ' Stayed 2 nights ', ' Submitted from a mobile device ']",3,312 day,9,312,756
2015-09-14,Gorgeous architecture and interior design particularly enjoyed the roof top terrace Staff we re extremely helpful,None,10,"[' Leisure trip ', ' Family with older children ', ' Superior Double or Twin Room ', ' Stayed 3 nights ']",4,689 day,9,689,757
2016-09-16,Nothing,The rooms are extremely small The area is maybe one of the dirtiest and worse areas of Paris There was no fridge and it was really hard to move inside this tiny space,3.3,"[' Leisure trip ', ' Couple ', ' Classic Double or Twin Room ', ' Stayed 3 nights ', ' Submitted from a mobile device ']",6,321 day,9,321,758
2015-09-01,Quite,Shower too small,7.5,"[' Leisure trip ', ' Couple ', ' Standard Twin Room ', ' Stayed 1 night ', ' Submitted from a mobile device ']",2,702 day,9,702,759
2016-09-22,Great location for eating out and access to transport Lovely contemporary rooms with great cosmetics Comfortable bed The spa looked lovely but we didn t have the time to use it The musical history of the hotel makes this a unique place to stay,My colleagues and I didn t particularly like being in the basement rooms The view out of my window was not good but the curtains were closed all the time As we weren t spending much time in the room this didn t really matter Also there was a slight drainage smell which was dealt with by the staff and the plumbing was quite noisy when in use Unfortunately we were unable to move rooms as the hotel was fully booked,9.6,"[' Business trip ', ' Solo traveler ', ' Junior Double ', ' Stayed 1 night ']",1,315 day,9,315,760
2016-09-27,Staf was very professional and courteous Housekeeping was very thorough Location was superb Facility is magnificent and well maintained Dining services were excellent,Room could have used a comfortable chair for seating,9.6,"[' Leisure trip ', ' Family with young children ', ' Standard Room with Spa access ', ' Stayed 21 nights ', ' Submitted from a mobile device ']",1,310 day,9,310,761
2016-09-27,Beautiful and great location,No Negative,9.6,"[' Business trip ', ' Solo traveler ', ' Classic Double Room ', ' Stayed 2 nights ', ' Submitted from a mobile device ']",3,310 day,9,310,762
2016-09-15,Great top Swimming pool with bar,Rooms a little bit outdated,9.2,"[' Leisure trip ', ' Couple ', ' Double or Twin Room with City View ', ' Stayed 3 nights ', ' Submitted from a mobile device ']",5,322 day,9,322,763
